party,political_position,ideology,wikipedia_url
My Step / CC,Centre,Liberal democracy Neoliberalism Reformism,https://en.wikipedia.org/wiki/My_Step_Alliance
I'm honored / RPA,Centre-right to right-wing,National conservatism Armenian nationalism Russophilia,https://en.wikipedia.org/wiki/I_Have_Honor_Alliance
PAP,Centre-right,Social conservatism Economic liberalism Russophilia Euroscepticism,https://en.wikipedia.org/wiki/Prosperous_Armenia
Bright Armenia,Centre,Classical liberalism Pro-Europeanism,https://en.wikipedia.org/wiki/Bright_Armenia
FD,Centre,Liberalism Pro-Europeanism Pro-Western Anti- EAEU,https://en.wikipedia.org/wiki/Free_Democrats_(Armenia)
NDP / ST,,Big tent [ citation needed ] Armenian nationalism Pro-Europeanism Pro-Western Anti-Russian,https://en.wikipedia.org/wiki/National_Democratic_Pole
ARF,Centre-left to left-wing,Armenian nationalism United Armenia Social market economy Left-wing populism,https://en.wikipedia.org/wiki/Armenian_Revolutionary_Federation
Republic,Centre to centre-right,Conservative liberalism Pro-Europeanism,https://en.wikipedia.org/wiki/Hanrapetutyun_Party
Armenia Alliance,Centre-left,Armenian nationalism Social market economy,https://en.wikipedia.org/wiki/Armenia_Alliance
