party,political_position,ideology,wikipedia_url
My_Step_Alliance,Centre,Liberal democracy Neoliberalism Reformism,https://en.wikipedia.org/wiki/My_Step_Alliance
I_Have_Honor_Alliance,Centre-right to right-wing,National conservatism Armenian nationalism Russophilia,https://en.wikipedia.org/wiki/I_Have_Honor_Alliance
Prosperous_Armenia,Centre-right,Social conservatism Economic liberalism Russophilia Euroscepticism,https://en.wikipedia.org/wiki/Prosperous_Armenia
Bright_Armenia,Centre,Classical liberalism Pro-Europeanism,https://en.wikipedia.org/wiki/Bright_Armenia
Free_Democrats_(Armenia),Centre,Liberalism Pro-Europeanism Pro-Western Anti- EAEU,https://en.wikipedia.org/wiki/Free_Democrats_(Armenia)
Hanrapetutyun_Party,Centre to centre-right,Conservative liberalism Pro-Europeanism,https://en.wikipedia.org/wiki/Hanrapetutyun_Party
National_Democratic_Pole,,Big tent [ citation needed ] Armenian nationalism Pro-Europeanism Pro-Western Anti-Russian,https://en.wikipedia.org/wiki/National_Democratic_Pole
Armenian_Revolutionary_Federation,Centre-left to left-wing,Armenian nationalism United Armenia Social market economy Populism Russophilia,https://en.wikipedia.org/wiki/Armenian_Revolutionary_Federation
Armenia_Alliance,Centre-left,Armenian nationalism Social market economy Russophilia,https://en.wikipedia.org/wiki/Armenia_Alliance
